{
  "name": "searchconsole",
  "repo": "https://github.com/Zen-Labs-Corp/hatamoto-first-party",
  "commit": "077051fd84adad2277990b25e8a8fdee3c4c6a50",
  "subdir": "plugins/searchconsole",
  "title": "Google Search Console",
  "license": "Apache-2.0",
  "sdk": "^0.8",
  "archive_grant": true,
  "tier": "first-party"
}
